{
  "schema_version": "1.0.0",
  "check_id": "fingerprint-check:routing:orchestration:synthetic-prose-strategy:v1:2",
  "checked_at": "2026-08-31T18:05:00+02:00",
  "routing_decision_ref": "routing:orchestration:synthetic-prose-strategy:v1:2",
  "guard_mode": "PRESERVE_EFFECTIVE",
  "baseline_fingerprint_ref": "fingerprint:synthetic-prose-strategy:v1",
  "baseline_fingerprint_sha256": "79c2266d2a0016047ab70f1cb9782028f3bfd196a4940e5f6daf09215fbf64a5",
  "candidate_fingerprint_ref": "fingerprint:synthetic-prose-strategy:v1",
  "candidate_fingerprint_sha256": "79c2266d2a0016047ab70f1cb9782028f3bfd196a4940e5f6daf09215fbf64a5",
  "overall_status": "UNCHANGED",
  "changes": [],
  "proposal": null,
  "plain_language_summary": "The complete research fingerprint is unchanged. No commitments or protected research artifacts were exchanged.",
  "candidate_may_become_effective": true
}
